{
  "schemaVersion": "2.0",
  "valid": true,
  "source": {
    "language": "go",
    "path": "examples/go/products/customer-refund/agentic/workflow.go"
  },
  "flow": {
    "name": "AgenticCustomerRefundFlow",
    "startStepId": "step:agenticReceiveRequest",
    "span": {
      "startLine": 191,
      "startColumn": 1,
      "endLine": 237,
      "endColumn": 2
    }
  },
  "nodes": [
    {
      "id": "decision-dispatch:step:agenticAuditIntent",
      "kind": "decision_dispatch",
      "name": "Decision",
      "parentId": "step:agenticAuditIntent",
      "phase": "execute",
      "span": {
        "startLine": 955,
        "startColumn": 1,
        "endLine": 967,
        "endColumn": 2
      }
    },
    {
      "id": "decision-dispatch:step:agenticDecision",
      "kind": "decision_dispatch",
      "name": "Decision",
      "parentId": "step:agenticDecision",
      "phase": "execute",
      "span": {
        "startLine": 582,
        "startColumn": 1,
        "endLine": 652,
        "endColumn": 2
      }
    },
    {
      "id": "decision-dispatch:step:agenticGuardrail",
      "kind": "decision_dispatch",
      "name": "Decision",
      "parentId": "step:agenticGuardrail",
      "phase": "execute",
      "span": {
        "startLine": 821,
        "startColumn": 1,
        "endLine": 868,
        "endColumn": 2
      }
    },
    {
      "id": "decision-dispatch:step:agenticIssueRefund",
      "kind": "decision_dispatch",
      "name": "Decision",
      "parentId": "step:agenticIssueRefund",
      "phase": "execute",
      "span": {
        "startLine": 989,
        "startColumn": 1,
        "endLine": 1012,
        "endColumn": 2
      }
    },
    {
      "id": "decision-dispatch:step:agenticOfferAccountCredit",
      "kind": "decision_dispatch",
      "name": "Decision",
      "parentId": "step:agenticOfferAccountCredit",
      "phase": "execute",
      "span": {
        "startLine": 1025,
        "startColumn": 1,
        "endLine": 1044,
        "endColumn": 2
      }
    },
    {
      "id": "decision-dispatch:step:agenticPrepareCustomerMessage",
      "kind": "decision_dispatch",
      "name": "Decision",
      "parentId": "step:agenticPrepareCustomerMessage",
      "phase": "execute",
      "span": {
        "startLine": 1122,
        "startColumn": 1,
        "endLine": 1156,
        "endColumn": 2
      }
    },
    {
      "id": "decision-dispatch:step:agenticReCheck",
      "kind": "decision_dispatch",
      "name": "Decision",
      "parentId": "step:agenticReCheck",
      "phase": "execute",
      "span": {
        "startLine": 880,
        "startColumn": 1,
        "endLine": 901,
        "endColumn": 2
      }
    },
    {
      "id": "decision-dispatch:step:agenticReceiveRequest",
      "kind": "decision_dispatch",
      "name": "Decision",
      "parentId": "step:agenticReceiveRequest",
      "phase": "execute",
      "span": {
        "startLine": 544,
        "startColumn": 1,
        "endLine": 570,
        "endColumn": 2
      }
    },
    {
      "id": "decision-dispatch:step:agenticVerifyBilling",
      "kind": "decision_dispatch",
      "name": "Decision",
      "parentId": "step:agenticVerifyBilling",
      "phase": "execute",
      "span": {
        "startLine": 1057,
        "startColumn": 1,
        "endLine": 1082,
        "endColumn": 2
      }
    },
    {
      "id": "decision:rpc:ApproveRefund:463:9",
      "kind": "decision",
      "name": "rpcResult",
      "parentId": "rpc:ApproveRefund",
      "phase": "rpc",
      "span": {
        "startLine": 463,
        "startColumn": 9,
        "endLine": 463,
        "endColumn": 35
      },
      "decision": {
        "type": "rpcResult"
      }
    },
    {
      "id": "decision:rpc:ConfirmCustomerMessage:506:9",
      "kind": "decision",
      "name": "rpcResult",
      "parentId": "rpc:ConfirmCustomerMessage",
      "phase": "rpc",
      "span": {
        "startLine": 506,
        "startColumn": 9,
        "endLine": 506,
        "endColumn": 35
      },
      "decision": {
        "type": "rpcResult"
      }
    },
    {
      "id": "decision:rpc:EditCustomerMessage:531:9",
      "kind": "decision",
      "name": "rpcResult",
      "parentId": "rpc:EditCustomerMessage",
      "phase": "rpc",
      "span": {
        "startLine": 531,
        "startColumn": 9,
        "endLine": 531,
        "endColumn": 35
      },
      "decision": {
        "type": "rpcResult"
      }
    },
    {
      "id": "decision:rpc:GetDexDisplay:432:9",
      "kind": "decision",
      "name": "rpcResult",
      "parentId": "rpc:GetDexDisplay",
      "phase": "rpc",
      "span": {
        "startLine": 432,
        "startColumn": 9,
        "endLine": 449,
        "endColumn": 4
      },
      "decision": {
        "type": "rpcResult"
      }
    },
    {
      "id": "decision:rpc:GetDexSummary:375:9",
      "kind": "decision",
      "name": "rpcResult",
      "parentId": "rpc:GetDexSummary",
      "phase": "rpc",
      "span": {
        "startLine": 375,
        "startColumn": 9,
        "endLine": 380,
        "endColumn": 4
      },
      "decision": {
        "type": "rpcResult"
      }
    },
    {
      "id": "decision:rpc:RejectRefund:488:9",
      "kind": "decision",
      "name": "rpcResult",
      "parentId": "rpc:RejectRefund",
      "phase": "rpc",
      "span": {
        "startLine": 488,
        "startColumn": 9,
        "endLine": 488,
        "endColumn": 35
      },
      "decision": {
        "type": "rpcResult"
      }
    },
    {
      "id": "decision:step:GenerateCustomerMessageStep:optional:providerRejected",
      "kind": "decision",
      "name": "forceFail",
      "parentId": "step:GenerateCustomerMessageStep",
      "condition": "providerRejected",
      "phase": "execute",
      "decision": {
        "type": "forceFail"
      }
    },
    {
      "id": "decision:step:agenticApplySubscription:1109:9",
      "kind": "decision",
      "name": "goTo",
      "parentId": "step:agenticApplySubscription",
      "phase": "execute",
      "span": {
        "startLine": 1109,
        "startColumn": 9,
        "endLine": 1109,
        "endColumn": 62
      },
      "decision": {
        "type": "goTo"
      }
    },
    {
      "id": "decision:step:agenticAuditIntent:964:10",
      "kind": "decision",
      "name": "goTo",
      "parentId": "step:agenticAuditIntent",
      "condition": "action == actionOfferAccountCredit",
      "phase": "execute",
      "span": {
        "startLine": 964,
        "startColumn": 10,
        "endLine": 964,
        "endColumn": 59
      },
      "decision": {
        "type": "goTo"
      }
    },
    {
      "id": "decision:step:agenticAuditIntent:966:9",
      "kind": "decision",
      "name": "goTo",
      "parentId": "step:agenticAuditIntent",
      "condition": "!(action == actionOfferAccountCredit)",
      "phase": "execute",
      "span": {
        "startLine": 966,
        "startColumn": 9,
        "endLine": 966,
        "endColumn": 51
      },
      "decision": {
        "type": "goTo"
      }
    },
    {
      "id": "decision:step:agenticBillingFailed:1384:9",
      "kind": "decision",
      "name": "goTo",
      "parentId": "step:agenticBillingFailed",
      "phase": "execute",
      "span": {
        "startLine": 1384,
        "startColumn": 9,
        "endLine": 1384,
        "endColumn": 62
      },
      "decision": {
        "type": "goTo"
      }
    },
    {
      "id": "decision:step:agenticCheckIdentity:672:9",
      "kind": "decision",
      "name": "goTo",
      "parentId": "step:agenticCheckIdentity",
      "phase": "execute",
      "span": {
        "startLine": 672,
        "startColumn": 9,
        "endLine": 672,
        "endColumn": 48
      },
      "decision": {
        "type": "goTo"
      }
    },
    {
      "id": "decision:step:agenticCheckIncidents:808:9",
      "kind": "decision",
      "name": "goTo",
      "parentId": "step:agenticCheckIncidents",
      "phase": "execute",
      "span": {
        "startLine": 808,
        "startColumn": 9,
        "endLine": 808,
        "endColumn": 48
      },
      "decision": {
        "type": "goTo"
      }
    },
    {
      "id": "decision:step:agenticCloseCase:1447:9",
      "kind": "decision",
      "name": "gracefulComplete",
      "parentId": "step:agenticCloseCase",
      "phase": "execute",
      "span": {
        "startLine": 1447,
        "startColumn": 9,
        "endLine": 1447,
        "endColumn": 60
      },
      "decision": {
        "type": "gracefulComplete"
      }
    },
    {
      "id": "decision:step:agenticConfirmCustomerMessage:1282:9",
      "kind": "decision",
      "name": "goTo",
      "parentId": "step:agenticConfirmCustomerMessage",
      "phase": "execute",
      "span": {
        "startLine": 1282,
        "startColumn": 9,
        "endLine": 1282,
        "endColumn": 59
      },
      "decision": {
        "type": "goTo"
      }
    },
    {
      "id": "decision:step:agenticDecision:591:10",
      "kind": "decision",
      "name": "goTo",
      "parentId": "step:agenticDecision",
      "condition": "rounds \u003e= decisionRoundsBudget",
      "phase": "execute",
      "span": {
        "startLine": 591,
        "startColumn": 10,
        "endLine": 591,
        "endColumn": 55
      },
      "decision": {
        "type": "goTo"
      }
    },
    {
      "id": "decision:step:agenticDecision:604:10",
      "kind": "decision",
      "name": "goTo",
      "parentId": "step:agenticDecision",
      "condition": "!(rounds \u003e= decisionRoundsBudget) and !hasIdentity",
      "phase": "execute",
      "span": {
        "startLine": 604,
        "startColumn": 10,
        "endLine": 604,
        "endColumn": 54
      },
      "decision": {
        "type": "goTo"
      }
    },
    {
      "id": "decision:step:agenticDecision:611:10",
      "kind": "decision",
      "name": "goTo",
      "parentId": "step:agenticDecision",